{
  "id": "12",
  "course": "dsa",
  "week_n": 2,
  "sort_order": 1,
  "title": "Longest Substring Without Repeating Characters",
  "difficulty": "med",
  "pattern": "Sliding Window",
  "role": "core",
  "status": "live",
  "provenance": {
    "origin": "original",
    "inspired_by": [
      "leetcode:longest-substring-without-repeating-characters"
    ],
    "authored_by": "ai-assisted"
  },
  "links": [
    {
      "kind": "leetcode",
      "url": "https://leetcode.com/problems/longest-substring-without-repeating-characters/"
    },
    {
      "kind": "neetcode",
      "url": "https://neetcode.io/problems/longest-substring-without-duplicates"
    }
  ]
}
