{
  "id": "5",
  "course": "dsa",
  "week_n": 1,
  "sort_order": 4,
  "title": "Group Anagrams",
  "difficulty": "med",
  "pattern": "Hashing",
  "role": "core",
  "status": "live",
  "provenance": {
    "origin": "original",
    "inspired_by": [
      "leetcode:group-anagrams"
    ],
    "authored_by": "ai-assisted"
  },
  "links": [
    {
      "kind": "leetcode",
      "url": "https://leetcode.com/problems/group-anagrams/"
    },
    {
      "kind": "neetcode",
      "url": "https://neetcode.io/problems/anagram-groups"
    }
  ]
}
