{
  "id": "fx-002",
  "course": "fixture",
  "week_n": 1,
  "sort_order": 2,
  "title": "Balanced Trios",
  "difficulty": "med",
  "pattern": "Sorting + two pointers",
  "role": "core",
  "status": "live",
  "provenance": {
    "origin": "original",
    "authored_by": "agent"
  },
  "review": { "statement": "2026-10-01" },
  "concepts": ["fixture:concept:fixture-basics"],
  "parts": [
    {
      "id": "solution",
      "type": "code",
      "cadence": "iterate",
      "grading": "auto",
      "required": true,
      "config": {
        "signature": {
          "mode": "function",
          "name": "trios",
          "params": [
            { "name": "nums", "type": "int[]" },
            { "name": "target", "type": "int" }
          ],
          "returns": "int[][]"
        },
        "languages": ["go", "cpp", "python"],
        "harness": "func-json@1",
        "checker": { "name": "unordered_deep" },
        "constraints": [
          { "arg": "nums", "len": [3, 3000] },
          { "arg": "nums[*]", "range": [-100000, 100000] },
          { "arg": "target", "range": [-300000, 300000] }
        ],
        "samples": [
          { "id": "s1", "args": [[1, 2, 3, 0, -1], 3], "expected": [[-1, 1, 3], [0, 1, 2]] },
          { "id": "s2", "args": [[0, 0, 0, 0], 0], "expected": [[0, 0, 0]] }
        ],
        "limits": { "time_ms": 1000, "memory_mb": 64 }
      }
    }
  ],
  "grader": [{ "step": "tests", "kind": "code", "inputs": ["solution"], "required": true }],
  "solution_facts": { "complexity": { "time": ["O(n^2)"], "space": ["O(1)", "O(log n)", "O(n)"] } }
}
