{
  "id": "16",
  "course": "dsa",
  "week_n": 2,
  "sort_order": 2,
  "title": "3Sum",
  "difficulty": "med",
  "pattern": "Two Pointers",
  "role": "core",
  "status": "live",
  "provenance": {
    "origin": "original",
    "inspired_by": [
      "leetcode:3sum"
    ],
    "authored_by": "ai-assisted"
  },
  "links": [
    {
      "kind": "leetcode",
      "url": "https://leetcode.com/problems/3sum/"
    },
    {
      "kind": "neetcode",
      "url": "https://neetcode.io/problems/three-integer-sum"
    }
  ]
}
